HTS_Code,Description,List
9031.49.70,"9031.90.59 Parts & accessories of measuring & checking optical instruments & appliances, other than test benches or profile projectors, nesoi",1
9031.90.70,Parts and accessories of articles of subheading,1
9031.80.40,"9031.90.91 Parts and accessories of measuring or checking instruments, appliances and machines, nesoi",1
9032.10.00,Automatic thermostats,1
9032.20.00,Automatic manostats,1
9032.81.00,Hydraulic and pneumatic automatic regulating or controlling instruments and apparatus,1
9032.89.20,"Automatic voltage and voltage-current regulators, designed for use in a 6, 12, or 24 V system",1
9032.89.40,"Automatic voltage and voltage-current regulators, not designed for use in a 6, 12, or 24 V system",1
9032.89.60,"Automatic regulating or controlling instruments and apparatus, nesoi",1
9032.90.21,"Parts and accessories of automatic voltage and voltage-current regulators designed for use in a 6, 12, or 24 V system, nesoi",1
9032.90.41,"Parts and accessories of automatic voltage and voltage-current regulators, not designed for use in a 6, 12, or 24 V system, nesoi",1
9032.90.61,"Parts and accessories for automatic regulating or controlling instruments and apparatus, nesoi",1
9033.00.20,LEDs for backlighting of LCDs HTSUS Product Description Subheading,1
9033.00.30,Touch screens without display capabilities for incorporation in apparatus having a display,1
9033.00.90,"Other parts and accessories for machines, appliances, instruments or apparatus of chapter 90, nesoi",1
