HTS_Code,Description,List
8701.91.10,"Other tractors of engine power <18kW, for agricultural use",2
8701.91.50,"Other tractors of engine power <18kW, not for agricultural use",2
8701.92.10,"Other tractors of engine power => 18kW but < 37kW, for agricultural use",2
8701.92.50,"Other tractors of engine power => 18kW but < 37kW, not for agricultural use",2
8701.93.10,"Other tractors of engine power => 37kW but < 75kW, for agricultural use",2
8701.93.50,"Other tractors of engine power => 37kW but < 75kW, not for agricultural use",2
8701.94.10,"Other tractors of engine power => 75kW but < 130kW, for agricultural use",2
8701.94.50,"Other tractors of engine power => 75kW but < 130kW, not for agricultural use",2
8701.95.10,"Other tractors of engine power >130kW, for agricultural use",2
8701.95.50,"Other tractors of engine power >130kW, not for agricultural use",2
8704.90.00,"Mtr. vehicles for transport of goods, o/than w/compress. ign. or spark ign. recip. piston engine, nesoi",2
8705.10.00,"Mtr. vehicles (o/than for transport of persons or of goods), mobile cranes",2
8705.20.00,"Mtr. vehicles (o/than for transport of persons or of goods), mobile drilling derricks",2
8705.90.00,"Mtr. vehicles (o/than for transport of persons or of goods), special purpose motor vehicles nesoi",2
8711.10.00,"Motorcycles (incl. mopeds) and cycles, fitted w/recip. internal-combustion piston engine w/capacity n/o 50 cc",2
8711.60.00,"Motorcycles (incl. mopeds) and cycles, w/electric motor for propulsion",2
8711.90.01,"Motorcycles (incl. mopeds) and cycles, nesoi",2
8901.30.00,"Vessels, designed for the transport of goods, refrigerated vessels (o/than tankers) HTSUS Product Description Subheading",2
8905.90.10,Floating docks,2
9001.10.00,"Optical fibers, optical fiber bundles and cables, other than those of heading 8544",2
9001.20.00,Sheets and plates of polarizing material,2
9014.10.90,"Direction finding compasses, other than optical instruments, gyroscopic compasses or electrical",2
9025.19.40,"Pyrometers, not combined with other instruments",2
9025.19.80,"Thermometers, for direct reading, not combined with other instruments, other than liquid-filled thermometers",2
9025.80.10,"Electrical: hydrometers & sim. floating instr., hygrometers, psychometers, & any comb. with or w/o thermometers, pyrometers, & barometers",2
9027.10.20,Electrical gas or smoke analysis apparatus,2
9027.90.20,Microtomes,2
9028.10.00,"Gas supply or production meters, including calibrating meters thereof",2
9028.20.00,"Liquid supply or production meters, including calibrating meters thereof",2
9028.30.00,"Electricity supply or production meters, including calibrating meters thereof",2
9029.20.40,"Speedometers and tachometers, other than bicycle speedometers",2
9029.90.80,"Parts and accessories of revolution counters, production counters, odometers, pedometers and the like, of speedometers nesoi and tachometers",2
9030.31.00,"Multimeters for measuring or checking electrical voltage, current, resistance or power, without a recording device",2
9030.32.00,"Multimeters, with a recording device",2
9030.84.00,"Instruments and apparatus for measuring, checking or detecting electrical quantities or ionizing radiations, nesoi: with a recording device",2
9030.89.01,"Instruments and apparatus for measuring, checking or detecting electrical quantities or ionizing radiations, nesoi: w/o a recording device",2
